{
    "baremeDemarche": [
        {
            "id": 1,
            "demarche": "Première immatriculation en France d'un véhicule",
            "baremeMotoMoins125": 0.5,
            "baremeAutre": 1
        },
        {
            "id": 2,
            "demarche": "Immatriculation d’un véhicule d’occasion (changement de titulaire du certificat)",
            "baremeMotoMoins125": 0.5,
            "baremeAutre": 1
        },
        {
            "id": 3,
            "demarche": "Duplicata - véhicule SIV (immatriculation type \"AB-123-CD\")",
            "baremeMotoMoins125": 0.25,
            "baremeAutre": 1
        },
        {
            "id": 4,
            "demarche": "Duplicata - véhicule FNI  (ancienne immatriculation de type \"1234 AB 01\")",
            "baremeMotoMoins125": 0,
            "baremeAutre": 0
        },
        {
            "id": 5,
            "demarche": "Changement d'adresse",
            "baremeMotoMoins125": 0,
            "baremeAutre": 0
        },
        {
            "id": 6,
            "demarche": "Changement d'état matrimonial (mariage, divorce, veuvage)",
            "baremeMotoMoins125": 0,
            "baremeAutre": 0
        },
        {
            "id": 7,
            "demarche": "Correction d'erreur de saisie sur le certificat du fait de l'administration",
            "baremeMotoMoins125": 0,
            "baremeAutre": 0
        },
        {
            "id": 8,
            "demarche": "Usurpation du numéro d'immatriculation du véhicule",
            "baremeMotoMoins125": 0,
            "baremeAutre": 0
        },
        {
            "id": 9,
            "demarche": "Utilisation de toutes les cases réservées pour les contrôles techniques",
            "baremeMotoMoins125": 0,
            "baremeAutre": 0
        },
        {
            "id": 10,
            "demarche": "Modification des caractéristiques techniques du véhicule",
            "baremeMotoMoins125": 0.25,
            "baremeAutre": 1
        },
        {
            "id": 11,
            "demarche": "Modification de l'usage du véhicule",
            "baremeMotoMoins125": 0.25,
            "baremeAutre": 1
        },
        {
            "id": 12,
            "demarche": "Changement d'état civil",
            "baremeMotoMoins125": 0.25,
            "baremeAutre": 1
        },
        {
            "id": 13,
            "demarche": "Changement de dénomination sociale d'une entreprise ou d'une association",
            "baremeMotoMoins125": 0.25,
            "baremeAutre": 1
        },
        {
            "id": 14,
            "demarche": "Certificat W garage",
            "baremeMotoMoins125": 2,
            "baremeAutre": 2
        },
        {
            "id": 15,
            "demarche": "Passage en véhicule de collection",
            "baremeMotoMoins125": 0.25,
            "baremeAutre": 1
        },
        {
            "id": 16,
            "demarche": "Héritage (hors veuvage) d'un véhicule",
            "baremeMotoMoins125": 0.5,
            "baremeAutre": 1
        },
        {
            "id": 17,
            "demarche": "Achat par locataire suite leasing",
            "baremeMotoMoins125": 0.5,
            "baremeAutre": 1
        },
        {
            "id": 18,
            "demarche": "Ajout d'un autre propriétaire (sauf conjoint)",
            "baremeMotoMoins125": 0.5,
            "baremeAutre": 1
        },
        {
            "id": 19,
            "demarche": "Certificat WW",
            "baremeMotoMoins125": 1,
            "baremeAutre": 1
        },
        {
            "id": 20,
            "demarche": "Série TT",
            "baremeMotoMoins125": 1.5,
            "baremeAutre": 1.5
        },
        {
            "id": 21,
            "demarche": "Véhicule acquis en remplacement d'un véhicule détruit lors d'une catastrophe naturelle\n",
            "baremeMotoMoins125": 0,
            "baremeAutre": 0
        },
        {
            "id": 22,
            "demarche": "Demande de duplicata d'un certificat détruit lors d'une catastrophe naturelle",
            "baremeMotoMoins125": 0,
            "baremeAutre": 0
        }
    ],
    "baremeVehicule": [
        {
            "id": 1,
            "typeVehicule": "Voiture particulière (VP)",
            "baremeMoins10": 1,
            "baremePlus10": 0.5,
            "taxeFPTransport": 0
        },
        {
            "id": 2,
            "typeVehicule": "Camionnette (CTTE)",
            "baremeMoins10": 1,
            "baremePlus10": 0.5,
            "taxeFPTransport": 34
        },
        {
            "id": 3,
            "typeVehicule": "Camping-car et autre véhicule VASP (PTAC égal à ou moins de 3,5 tonnes)",
            "baremeMoins10": 1,
            "baremePlus10": 0.5,
            "taxeFPTransport": 0
        },
        {
            "id": 4,
            "typeVehicule": "Camping-car et autre véhicule VASP (PTAC supérieur à 3,5 tonnes)",
            "baremeMoins10": 0.5,
            "baremePlus10": 0.25,
            "taxeFPTransport": 0
        },
        {
            "id": 5,
            "typeVehicule": "Moto jusqu'à 125 cm3 (MTL)",
            "baremeMoins10": 0.5,
            "baremePlus10": 0.25,
            "taxeFPTransport": 0
        },
        {
            "id": 6,
            "typeVehicule": "Moto de plus de 125 cm3 (MTT1 \/ MTT2)",
            "baremeMoins10": 0.5,
            "baremePlus10": 0.25,
            "taxeFPTransport": 0
        },
        {
            "id": 7,
            "typeVehicule": "Tricycle à moteur (TM)",
            "baremeMoins10": 1,
            "baremePlus10": 0.5,
            "taxeFPTransport": 0
        },
        {
            "id": 8,
            "typeVehicule": "Quadricycle à moteur (QM)",
            "baremeMoins10": 1,
            "baremePlus10": 0.5,
            "taxeFPTransport": 0
        },
        {
            "id": 9,
            "typeVehicule": "Cyclomoteur à 3 roues (CYCL)",
            "baremeMoins10": 1,
            "baremePlus10": 0.5,
            "taxeFPTransport": 0
        },
        {
            "id": 10,
            "typeVehicule": "Cyclomoteur à 2 roues ou à 3 roues (inférieur ou égal à 50 cm3) non carrossé (CL)",
            "baremeMoins10": 0,
            "baremePlus10": 0,
            "taxeFPTransport": 0
        },
        {
            "id": 11,
            "typeVehicule": "Camion d'un PTAC supérieur à 3,5 tonnes et inférieur à 6 tonnes (CAM)",
            "baremeMoins10": 0.5,
            "baremePlus10": 0.25,
            "taxeFPTransport": 127
        },
        {
            "id": 12,
            "typeVehicule": "Camion d'un PTAC supérieur ou égal à 6 tonnes et inférieur à 11 tonnes (CAM)",
            "baremeMoins10": 0.5,
            "baremePlus10": 0.25,
            "taxeFPTransport": 189
        },
        {
            "id": 13,
            "typeVehicule": "Camion d'un PTAC supérieur ou égal à 11 tonnes (CAM)",
            "baremeMoins10": 0.5,
            "baremePlus10": 0.25,
            "taxeFPTransport": 285
        },
        {
            "id": 14,
            "typeVehicule": "Véhicule de transport en commun d'un PTAC inférieur ou égal à 3,5 tonnes (TCP)",
            "baremeMoins10": 1,
            "baremePlus10": 0.5,
            "taxeFPTransport": 285
        },
        {
            "id": 15,
            "typeVehicule": "Véhicule de transport en commun d'un PTAC supérieur à 3,5 tonnes (TCP)",
            "baremeMoins10": 0.5,
            "baremePlus10": 0.25,
            "taxeFPTransport": 285
        },
        {
            "id": 16,
            "typeVehicule": "Tracteur routier (TRR)",
            "baremeMoins10": 0.5,
            "baremePlus10": 0.25,
            "taxeFPTransport": 285
        },
        {
            "id": 17,
            "typeVehicule": "Véhicule agricole (TRA \/ MAGA)",
            "baremeMoins10": 1.5,
            "baremePlus10": 1.5,
            "taxeFPTransport": 0
        },
        {
            "id": 18,
            "typeVehicule": "Remorque ou semi-remorque agricole ou non-agricole (SRAT \/ SREM \/ REM \/ SRTC \/ RETC \/ SRSP \/ RESP \/ REA \/ SREA \/ MIAR)",
            "baremeMoins10": 1.5,
            "baremePlus10": 1.5,
            "taxeFPTransport": 0
        },
        {
            "id": 23,
            "typeVehicule": "Caravane tractée (genre RESP)",
            "baremeMoins10": 1.5,
            "baremePlus10": 1.5,
            "taxeFPTransport": 0
        }
    ],
    "malusCV": [
        {
            "id": 1,
            "annee": 2008,
            "minCV": 0,
            "maxCV": 7,
            "malus": 0
        },
        {
            "id": 2,
            "annee": 2008,
            "minCV": 8,
            "maxCV": 11,
            "malus": 750
        },
        {
            "id": 3,
            "annee": 2008,
            "minCV": 12,
            "maxCV": 16,
            "malus": 1600
        },
        {
            "id": 4,
            "annee": 2008,
            "minCV": 17,
            "maxCV": 99,
            "malus": 2600
        },
        {
            "id": 5,
            "annee": 2009,
            "minCV": 0,
            "maxCV": 7,
            "malus": 0
        },
        {
            "id": 6,
            "annee": 2009,
            "minCV": 8,
            "maxCV": 11,
            "malus": 750
        },
        {
            "id": 7,
            "annee": 2009,
            "minCV": 12,
            "maxCV": 16,
            "malus": 1600
        },
        {
            "id": 8,
            "annee": 2009,
            "minCV": 17,
            "maxCV": 99,
            "malus": 2600
        },
        {
            "id": 9,
            "annee": 2010,
            "minCV": 0,
            "maxCV": 7,
            "malus": 0
        },
        {
            "id": 10,
            "annee": 2010,
            "minCV": 8,
            "maxCV": 11,
            "malus": 750
        },
        {
            "id": 11,
            "annee": 2010,
            "minCV": 12,